{
  "agent_batch_version": 1,
  "completed_at": "2026-09-03T19:35:36Z",
  "estimated_cost_per_operation": "0.25",
  "estimated_model_budget_used": "0",
  "maximum_model_budget": "5",
  "maximum_operations": 0,
  "operation_count": 0,
  "outcomes": [],
  "run_id": "dev-rebased-publication-v5b-20260903",
  "started_at": "2026-09-03T19:35:36Z"
}
